<?xml version="1.0" encoding="UTF-8"?>
<!--Правим xml файл, който да бъде валиден и да изпълнява изброените в условието изисквания. -->

<!DOCTYPE games SYSTEM "task6.dtd">
<games>
    <game score="1-1">
           <home-team>Roma</home-team>
           <ex-team>Lazio</ex-team>
           <scores>
              <score me="15">
                <player>Klose</player>
              </score>
              <score me="85" type="penalty">
                <player>Tox</player>
              </score>
           </scores>
        <yellows>
           <player>Tox</player>
           <player>Hernanes</player>
        </yellows>
        <reds>
           <player>Kjaer</player>
        </reds>
    </game>
</games>